hits,title,year,authors,key,ee,venue_category
950,Adaptive stiffness estimation impedance control for achieving sustained contact in aerial manipulation.,2021,Lovro Markovic & Marko Car & Matko Orsag & Stjepan Bogdan,conf/icra/MarkovicCOB21,https://doi.org/10.1109/ICRA48506.2021.9561886,Robotics
951,Cooperative Adaptive Control for Cloud-Based Robotics.,2018,Patrick M. Wensing & Jean-Jacques E. Slotine,conf/icra/WensingS18,https://doi.org/10.1109/ICRA.2018.8460856,Robotics
952,An adaptive compliant multi-finger approach-to-grasp strategy for objects with position uncertainties.,2015,Zhaopeng Chen & Thomas Wimböck & Máximo A. Roa & Benedikt Pleintinger & Miguel Neves 0002 & Christian Ott 0001 & Christoph Borst & Neal Y. Lii,conf/icra/ChenWRPNOBL15,https://doi.org/10.1109/ICRA.2015.7139881,Robotics
953,A highly parallelized control system platform architecture using multicore CPU and FPGA for multi-DoF robots.,2014,Sangok Seok & Dong Jin Hyun & SangIn Park & David Otten & Sangbae Kim,conf/icra/SeokHPOK14,https://doi.org/10.1109/ICRA.2014.6907655,Robotics
954,Self-supervised Transparent Liquid Segmentation for Robotic Pouring.,2022,Gautham Narayan Narasimhan & Kai Zhang & Ben Eisner & Xingyu Lin & David Held,conf/icra/NarasimhanZELH22,https://doi.org/10.1109/ICRA46639.2022.9812000,Robotics
955,Experiments in Adaptive Replanning for Fast Autonomous Flight in Forests.,2022,Laura Jarin-Lipschitz & Xu Liu 0007 & Yuezhan Tao & Vijay Kumar 0001,conf/icra/Jarin-Lipschitz22,https://doi.org/10.1109/ICRA46639.2022.9812235,Robotics
956,A self-adaptive variable impedance actuator based on intrinsic non-linear compliance and damping principles.,2017,Navvab Kashiri & Darwin G. Caldwell & Nikolaos G. Tsagarakis,conf/icra/KashiriCT17,https://doi.org/10.1109/ICRA.2017.7989148,Robotics
957,Adaptive motor control and learning in a spiking neural network realised on a mixed-signal neuromorphic processor.,2019,Sebastian Glatz & Julien N. P. Martel & Raphaela Kreiser & Ning Qiao & Yulia Sandamirskaya,conf/icra/GlatzMKQS19,https://doi.org/10.1109/ICRA.2019.8794145,Robotics
958,Beelines: Motion Prediction Metrics for Self-Driving Safety and Comfort.,2021,Skanda Shridhar & Yuhang Ma & Tara Stentz & Zhengdi Shen & Galen Clark Haynes & Neil Traft,conf/icra/ShridharMSSHT21,https://doi.org/10.1109/ICRA48506.2021.9560950,Robotics
959,PA-AWCNN: Two-stream Parallel Attention Adaptive Weight Network for RGB-D Action Recognition.,2022,Lu Yao & Sheng Liu 0002 & Chaonan Li & Siyu Zou & Shengyong Chen & Diyi Guan,conf/icra/Yao0LZCG22,https://doi.org/10.1109/ICRA46639.2022.9811995,Robotics
960,Robust; Occlusion-aware Pose Estimation for Objects Grasped by Adaptive Hands.,2020,Bowen Wen & Chaitanya Mitash & Sruthi Soorian & Andrew Kimmel & Avishai Sintov & Kostas E. Bekris,conf/icra/WenMSKSB20,https://doi.org/10.1109/ICRA40945.2020.9197350,Robotics
961,Adaptive assist-as-needed controller to improve gait symmetry in robot-assisted gait training.,2014,Damiano Zanotto & Paul Stegall & Sunil Kumar Agrawal,conf/icra/ZanottoSA14,https://doi.org/10.1109/ICRA.2014.6906934,Robotics
962,Adaptive control of a human-driven knee joint orthosis.,2012,Hala Rifai & Samer Mohammed & Boubaker Daachi & Yacine Amirat,conf/icra/RifaiMDA12,https://doi.org/10.1109/ICRA.2012.6225064,Robotics
963,Depth by Poking: Learning to Estimate Depth from Self-Supervised Grasping.,2020,Ben Goodrich & Alex Kuefler & William D. Richards,conf/icra/GoodrichKR20,https://doi.org/10.1109/ICRA40945.2020.9196797,Robotics
964,L1Adaptive Augmentation for Geometric Tracking Control of Quadrotors.,2022,Zhuohuan Wu & Sheng Cheng & Kasey A. Ackerman & Aditya Gahlawat & Arun Lakshmanan & Pan Zhao & Naira Hovakimyan,conf/icra/WuCAGLZH22,https://doi.org/10.1109/ICRA46639.2022.9811946,Robotics
965,Regressor-free tracking of robots with self-tuning PD-like control.,2013,Jorge Armendariz & Vicente Parra-Vega & Rodolfo García-Rodríguez & Shinichi Hirai & Sergio Rosales & Felipe Alberto Machorro-Fernández,conf/icra/ArmendarizPGHRM13,https://doi.org/10.1109/ICRA.2013.6630837,Robotics
966,Rapid transfer of controllers between UAVs using learning-based adaptive control.,2013,Girish Chowdhary 0001 & Tongbin Wu & Mark Cutler & Jonathan P. How,conf/icra/ChowdharyWCH13,https://doi.org/10.1109/ICRA.2013.6631353,Robotics
967,Combining self-supervised learning and imitation for vision-based rope manipulation.,2017,Ashvin Nair & Dian Chen 0001 & Pulkit Agrawal & Phillip Isola & Pieter Abbeel & Jitendra Malik & Sergey Levine,conf/icra/NairCAIAML17,https://doi.org/10.1109/ICRA.2017.7989247,Robotics
968,Adaptive neural network Dynamic Surface Control: An evaluation on the musculoskeletal robot Anthrob.,2015,Michael Jäntsch & Steffen Wittmeier & Konstantinos Dalamagkidis & Guido Herrmann & Alois C. Knoll,conf/icra/JantschWDHK15,https://doi.org/10.1109/ICRA.2015.7139799,Robotics
969,A Dual-Stream Architecture for Real-Time Morphological Analysis of Aneurysm in Robot-Assisted Minimally Invasive Surgery.,2022,Yan-Jie Zhou & Shi-Qi Liu 0004 & Xiao-Liang Xie & Xiao-Hu Zhou & Zeng-Guang Hou & Rui-Qi Li & Zhen-Liang Ni & Chen-Chen Fan,conf/icra/ZhouLXZHLNF22,https://doi.org/10.1109/ICRA46639.2022.9812075,Robotics
970,Uncertainty-Based Adaptive Sensor Fusion for Visual-Inertial Odometry under Various Motion Characteristics.,2020,Ryo Nakashima & Akihito Seki,conf/icra/NakashimaS20,https://doi.org/10.1109/ICRA40945.2020.9197397,Robotics
971,Characterizing Architectures of Soft Pneumatic Actuators for a Cable-Driven Shoulder Exoskeleton.,2019,Nicholas Thompson & Ayush Sinha & Girish Krishnan,conf/icra/ThompsonSK19,https://doi.org/10.1109/ICRA.2019.8793707,Robotics
972,Adaptive robust wing trajectory control and force generation of flapping wing MAV.,2015,Jian Zhang 0050 & Bo Cheng 0002 & Bin Yao & Xinyan Deng,conf/icra/ZhangCYD15,https://doi.org/10.1109/ICRA.2015.7140018,Robotics
973,Energy harvesting analysis for Moball; A self-propelled mobile sensor platform capable of long duration operation in harsh terrains.,2014,Matthew R. Burkhardt & Faranak Davoodi & Joel W. Burdick & Farhooman Davoudi,conf/icra/BurkhardtDBD14,https://doi.org/10.1109/ICRA.2014.6907241,Robotics
974,Self-supervised Learning of LiDAR Odometry for Robotic Applications.,2021,Julian Nubert & Shehryar Khattak & Marco Hutter 0001,conf/icra/NubertK021,https://doi.org/10.1109/ICRA48506.2021.9561063,Robotics
975,Self-Supervised Deep Reinforcement Learning with Generalized Computation Graphs for Robot Navigation.,2018,Gregory Kahn & Adam Villaflor & Bosen Ding & Pieter Abbeel & Sergey Levine,conf/icra/KahnVDAL18,https://doi.org/10.1109/ICRA.2018.8460655,Robotics
976,Real-time control architecture of a novel Single-Port lapaRoscopy bimaNual roboT (SPRINT).,2012,Marta Niccolini & Gianluigi Petroni & Arianna Menciassi & Paolo Dario,conf/icra/NiccoliniPMD12,https://doi.org/10.1109/ICRA.2012.6224984,Robotics
977,Role adaptation of human and robot in collaborative tasks.,2015,Yanan Li 0001 & Keng Peng Tee & Wei Liang Chan & Rui Yan & Yuanwei Chua & Dilip Kumar Limbu,conf/icra/LiTCYCL15,https://doi.org/10.1109/ICRA.2015.7139983,Robotics
978,SRAC: Self-Reflective Risk-Aware Artificial Cognitive models for robot response to human activities.,2016,Hao Zhang 0011 & Christopher M. Reardon & Fei Han 0002 & Lynne E. Parker,conf/icra/ZhangRHP16,https://doi.org/10.1109/ICRA.2016.7487503,Robotics
979,Self-Guided Instance-Aware Network for Depth Completion and Enhancement.,2021,Zhongzhen Luo & Fengjia Zhang & Guoyi Fu & Jiajie Xu 0005,conf/icra/LuoZF021,https://doi.org/10.1109/ICRA48506.2021.9561523,Robotics
980,MANGA: Method Agnostic Neural-policy Generalization and Adaptation.,2020,Homanga Bharadhwaj & Shoichiro Yamaguchi & Shin-ichi Maeda,conf/icra/BharadhwajYM20,https://doi.org/10.1109/ICRA40945.2020.9197398,Robotics
981,Adaptive Visual Shock Absorber with Visual-based Maxwell Model Using a Magnetic Gear.,2020,Satoshi Tanaka & Keisuke Koyama & Taku Senoo & Masatoshi Ishikawa,conf/icra/TanakaKSI20,https://doi.org/10.1109/ICRA40945.2020.9197504,Robotics
982,Adaptive Vision-Based Control of Redundant Robots with Null-Space Interaction for Human-Robot Collaboration.,2022,Xiangjie Yan & Chen Chen & Xiang Li 0009,conf/icra/YanCL22,https://doi.org/10.1109/ICRA46639.2022.9812218,Robotics
983,Self-supervised learning of tool affordances from 3D tool representation through parallel SOM mapping.,2017,Tanis Mar & Vadim Tikhanoff & Giorgio Metta & Lorenzo Natale,conf/icra/MarTMN17,https://doi.org/10.1109/ICRA.2017.7989110,Robotics
984,Probabilistic Safety-Assured Adaptive Merging Control for Autonomous Vehicles.,2021,Yiwei Lyu & Wenhao Luo & John M. Dolan,conf/icra/LyuLD21,https://doi.org/10.1109/ICRA48506.2021.9561894,Robotics
985,Collective Transport of Unconstrained Objects via Implicit Coordination and Adaptive Compliance.,2021,Nicole E. Carey & Justin Werfel,conf/icra/CareyW21,https://doi.org/10.1109/ICRA48506.2021.9561186,Robotics
986,A Multilayer-Multimodal Fusion Architecture for Pattern Recognition of Natural Manipulations in Percutaneous Coronary Interventions.,2020,Xiao-Hu Zhou & Xiao-Liang Xie & Zhen-Qiu Feng & Zeng-Guang Hou & Gui-Bin Bian & Rui-Qi Li & Zhen-Liang Ni & Shi-Qi Liu 0004 & Yan-Jie Zhou,conf/icra/ZhouXFHBLNLZ20,https://doi.org/10.1109/ICRA40945.2020.9197111,Robotics
987,Robust adaptive control of quadrotor unmanned aerial vehicle with uncertainty.,2015,Shafiqul Islam & Muhammad Faraz Faraz & Reem K. Ashour & Jorge Manuel Miranda Dias & Lakmal D. Seneviratne,conf/icra/IslamFADS15,https://doi.org/10.1109/ICRA.2015.7139417,Robotics
988,Time-Domain Passivity-based Controller with an Optimal Two-channel Lawrence Telerobotic Architecture*.,2021,Navid Feizi & Smrithi Thudi & Rajni V. Patel & Seyed Farokh Atashzar,conf/icra/FeiziTPA21,https://doi.org/10.1109/ICRA48506.2021.9561930,Robotics
989,Comfortable and Safe Decelerations for a Self-Driving Transit Bus.,2021,Alexis Mifsud & Matteo Ciocca & Pierre-Brice Wieber,conf/icra/MifsudCW21,https://doi.org/10.1109/ICRA48506.2021.9561648,Robotics
990,Adaptation to Team Composition Changes for Heterogeneous Multi-Robot Sensor Coverage.,2021,Brian Reily & Terran Mott & Hao Zhang 0011,conf/icra/ReilyMZ21,https://doi.org/10.1109/ICRA48506.2021.9560960,Robotics
991,Versatile aerial grasping using self-sealing suction.,2016,Chad C. Kessens & Justin Thomas & Jaydev P. Desai & Vijay Kumar 0001,conf/icra/KessensTD016,https://doi.org/10.1109/ICRA.2016.7487495,Robotics
992,Covariance Self-Attention Dual Path UNet for Rectal Tumor Segmentation.,2021,Haijun Gao & Xiangyin Zeng & Dazhi Pan & Bochuan Zheng,conf/icra/GaoZPZ21,https://doi.org/10.1109/ICRA48506.2021.9561826,Robotics
993,Model Reference Adaptive Control of Multirotor for Missions with Dynamic Change of Payloads During Flight.,2020,Toshiya Maki & Moju Zhao & Fan Shi & Kei Okada & Masayuki Inaba,conf/icra/MakiZSOI20,https://doi.org/10.1109/ICRA40945.2020.9196861,Robotics
994,Tunneling-based self-reconfiguration of heterogeneous sliding cube-shaped modular robots in environments with obstacles.,2017,Hiroshi Kawano,conf/icra/Kawano17,https://doi.org/10.1109/ICRA.2017.7989100,Robotics
995,Analyzing modular CNN architectures for joint depth prediction and semantic segmentation.,2017,Omid Hosseini Jafari & Oliver Groth & Alexander Kirillov & Michael Ying Yang & Carsten Rother,conf/icra/JafariGKYR17,https://doi.org/10.1109/ICRA.2017.7989537,Robotics
996,Real-time distributed configuration discovery of modular self-reconfigurable robots.,2015,José Baca & Bradley Woosley & Prithviraj Dasgupta & Carl A. Nelson,conf/icra/BacaWDN15,https://doi.org/10.1109/ICRA.2015.7139449,Robotics
997,AMI: Adaptive Motion Imitation Algorithm Based on Deep Reinforcement Learning.,2022,Nazita Taghavi & Moath H. A. Alqatamin & Dan O. Popa,conf/icra/TaghaviAP22,https://doi.org/10.1109/ICRA46639.2022.9812121,Robotics
998,Adapting the Goals/Questions/Metrics (GQM) Method for Applications in Robot Design.,2018,Conor McGinn & Eamonn Bourke & Tiarnan O. Kelly & Michael Francis Cullinan,conf/icra/McGinnBKC18,https://doi.org/10.1109/ICRA.2018.8460630,Robotics
999,Drift-correcting self-calibration for visual-inertial SLAM.,2017,Fernando Nobre & Michael Kasper & Christoffer R. Heckman,conf/icra/NobreKH17,https://doi.org/10.1109/ICRA.2017.7989771,Robotics
1000,Between-leg coupling schemes for passively-adaptive non-redundant legged robots.,2017,Oren Y. Kanner & Nicolas Rojas 0002 & Aaron M. Dollar,conf/icra/KannerRD17,https://doi.org/10.1109/ICRA.2017.7989129,Robotics
1001,Characterisation of Self-locking High-contraction Electro-ribbon Actuators*.,2020,Majid Taghavi & Tim Helps & Jonathan Rossiter,conf/icra/TaghaviHR20,https://doi.org/10.1109/ICRA40945.2020.9196849,Robotics
1002,FaNeuRobot: A Framework for Robot and Prosthetics Control Using the NeuCube Spiking Neural Network Architecture and Finite Automata Theory.,2018,Kaushalya Kumarasinghe & Mahonri Owen & Denise Taylor & Nikola K. Kasabov & Chi Kit,conf/icra/KumarasingheOTK18,https://doi.org/10.1109/ICRA.2018.8460197,Robotics
1003,ARChemist: Autonomous Robotic Chemistry System Architecture.,2022,Hatem Fakhruldeen & Gabriella Pizzuto & Jakub Glowacki & Andrew Ian Cooper,conf/icra/FakhruldeenPGC22,https://doi.org/10.1109/ICRA46639.2022.9811996,Robotics
1004,A GNC Architecture for Planetary Rovers with Autonomous Navigation.,2020,Martin Azkarate & Levin Gerdes & Luc Joudrier & Carlos Jesús Pérez-del-Pulgar,conf/icra/AzkarateGJP20,https://doi.org/10.1109/ICRA40945.2020.9197122,Robotics
1005,Coverage control of mobile sensors for adaptive search of unknown number of targets.,2012,Amit Surana & George Mathew & Suresh Kannan,conf/icra/SuranaMK12,https://doi.org/10.1109/ICRA.2012.6225106,Robotics
1006,Online self-supervised multi-instance segmentation of dynamic objects.,2014,Alex Bewley & Vitor Campanholo Guizilini & Fabio Tozeto Ramos & Ben Upcroft,conf/icra/BewleyGRU14,https://doi.org/10.1109/ICRA.2014.6907020,Robotics
1007,Autonomous Navigation for Adaptive Unmanned Underwater Vehicles Using Fiducial Markers.,2021,Juan Chen & Caiming Sun & Aidong Zhang,conf/icra/ChenSZ21,https://doi.org/10.1109/ICRA48506.2021.9561419,Robotics
1008,Data-Driven Adaptive Task Allocation for Heterogeneous Multi-Robot Teams Using Robust Control Barrier Functions.,2021,Yousef Emam & Gennaro Notomista & Paul Glotfelter & Magnus Egerstedt,conf/icra/EmamNGE21,https://doi.org/10.1109/ICRA48506.2021.9560857,Robotics
1009,Locomotion as a Risk-mitigating Behavior in Uncertain Environments: A Rapid Planning and Few-shot Failure Adaptation Approach.,2022,Jacob Hackett & Dylan Epstein-Gross & Monica A. Daley & Christian Hubicki,conf/icra/HackettEDH22,https://doi.org/10.1109/ICRA46639.2022.9812103,Robotics
1010,A Hierarchical Deliberative-Reactive System Architecture for Task and Motion Planning in Partially Known Environments.,2022,Vasileios Vasilopoulos & Sebastian Castro & William Vega-Brown & Daniel E. Koditschek & Nicholas Roy,conf/icra/VasilopoulosCVK22,https://doi.org/10.1109/ICRA46639.2022.9811936,Robotics
1011,Reducing the Deployment-Time Inference Control Costs of Deep Reinforcement Learning Agents via an Asymmetric Architecture.,2021,Chin-Jui Chang & Yu-Wei Chu & Chao-Hsien Ting & Hao-Kang Liu & Zhang-Wei Hong & Chun-Yi Lee,conf/icra/ChangCTLHL21,https://doi.org/10.1109/ICRA48506.2021.9562026,Robotics
1012,Calibration of industrial robots with product-of-exponential (POE) model and adaptive Neural Networks.,2015,Pey Yuen Tao & G. Yang,conf/icra/TaoY15,https://doi.org/10.1109/ICRA.2015.7139380,Robotics
1013,A Synchronization Approach for Achieving Cooperative Adaptive Cruise Control Based Non-Stop Intersection Passing.,2020,Zhe Liu 0022 & Huanshu Wei & Hanjiang Hu & Chuanzhe Suo & Hesheng Wang 0001 & Haoang Li & Yun-Hui Liu,conf/icra/LiuWHSWLL20,https://doi.org/10.1109/ICRA40945.2020.9196991,Robotics
1014,An adaptive descriptor for uncalibrated omnidirectional images - towards scene reconstruction by trifocal tensor.,2013,Ming Liu 0001 & Bekir Tufan Alper & Roland Siegwart,conf/icra/LiuAS13,https://doi.org/10.1109/ICRA.2013.6630629,Robotics
1015,Recurrent Neural Networks for driver activity anticipation via sensory-fusion architecture.,2016,Ashesh Jain & Avi Singh & Hema Swetha Koppula & Shane Soh & Ashutosh Saxena,conf/icra/JainSKSS16,https://doi.org/10.1109/ICRA.2016.7487478,Robotics
1016,OSCAR: Data-Driven Operational Space Control for Adaptive and Robust Robot Manipulation.,2022,Josiah Wong & Viktor Makoviychuk & Anima Anandkumar & Yuke Zhu,conf/icra/WongMAZ22,https://doi.org/10.1109/ICRA46639.2022.9811967,Robotics
1017,Area of acceptance for 3D self-aligning robotic connectors: Concepts; metrics; and designs.,2014,Nick Eckenstein & Mark Yim,conf/icra/EckensteinY14,https://doi.org/10.1109/ICRA.2014.6907010,Robotics
1018,Accurate and Adaptive in Situ Fabrication of an Undulated Wall Using an on-Board Visual Sensing System.,2018,Manuel Lussi & Timothy Sandy & Kathrin Dörfler & Norman Hack & Fabio Gramazio & Matthias Kohler & Jonas Buchli,conf/icra/LussiSDHGKB18,https://doi.org/10.1109/ICRA.2018.8460480,Robotics
1019,Adaptive control for pivoting with visual and tactile feedback.,2016,Francisco Eli Vina Barrientos & Yiannis Karayiannidis & Christian Smith & Danica Kragic,conf/icra/BarrientosKSK16,https://doi.org/10.1109/ICRA.2016.7487159,Robotics
1020,Improving Data Efficiency of Self-supervised Learning for Robotic Grasping.,2019,Lars Berscheid & Thomas Rühr & Torsten Kröger,conf/icra/BerscheidRK19,https://doi.org/10.1109/ICRA.2019.8793952,Robotics
1021,An Adaptive Supervisory Control Approach to Dynamic Locomotion Under Parametric Uncertainty.,2020,Prem Chand & Sushant Veer & Ioannis Poulakakis,conf/icra/ChandVP20,https://doi.org/10.1109/ICRA40945.2020.9197120,Robotics
1022,Versatile distributed pose estimation and sensor self-calibration for an autonomous MAV.,2012,Stephan Weiss 0002 & Markus Achtelik & Margarita Chli & Roland Siegwart,conf/icra/WeissACS12,https://doi.org/10.1109/ICRA.2012.6225002,Robotics
1023,A neurorobotic model of bipedal locomotion based on principles of human neuromuscular architecture.,2012,Theresa J. Klein & M. Anthony Lewis,conf/icra/KleinL12,https://doi.org/10.1109/ICRA.2012.6225149,Robotics
1024,Self-Supervised Ego-Motion Estimation Based on Multi-Layer Fusion of RGB and Inferred Depth.,2022,Zijie Jiang & Hajime Taira & Naoyuki Miyashita & Masatoshi Okutomi,conf/icra/JiangTMO22,https://doi.org/10.1109/ICRA46639.2022.9811842,Robotics
1025,Model Reference Adaptive Control of a Two-Wheeled Mobile Robot.,2019,Hussein Al Jleilaty & Daniel C. Asmar & Naseem A. Daher,conf/icra/JleilatyAD19,https://doi.org/10.1109/ICRA.2019.8793633,Robotics
1026,Adaptive Nonlinear Model Predictive Control for Autonomous Surface Vessels With Largely Varying Payload.,2021,Wei Wang 0239 & Niklas Hagemann & Carlo Ratti & Daniela Rus,conf/icra/0239HRR21,https://doi.org/10.1109/ICRA48506.2021.9561331,Robotics
1027,Robot Learning of 6 DoF Grasping using Model-based Adaptive Primitives.,2021,Lars Berscheid & Christian Friedrich & Torsten Kröger,conf/icra/BerscheidFK21,https://doi.org/10.1109/ICRA48506.2021.9560901,Robotics
1028,Multi-armed bandit formulation for autonomous mobile acoustic relay adaptive positioning.,2013,Mei Yi Cheung & Joshua Leighton & Franz S. Hover,conf/icra/CheungLH13,https://doi.org/10.1109/ICRA.2013.6631165,Robotics
1029,Autonomous Feature Tracing and Adaptive Sampling in Real-World Underwater Environments.,2018,Anwar Quraishi & Alexander Bahr & Felix Schill & Alcherio Martinoli,conf/icra/QuraishiBSM18,https://doi.org/10.1109/ICRA.2018.8460627,Robotics
1030,Beyond Photometric Loss for Self-Supervised Ego-Motion Estimation.,2019,Tianwei Shen & Zixin Luo & Lei Zhou & Hanyu Deng & Runze Zhang & Tian Fang & Long Quan,conf/icra/ShenLZDZFQ19,https://doi.org/10.1109/ICRA.2019.8793479,Robotics
1031,Online DCM Trajectory Adaptation for Push and Stumble Recovery during Humanoid Locomotion.,2021,George Mesesan & Johannes Englsberger & Christian Ott 0001,conf/icra/MesesanEO21,https://doi.org/10.1109/ICRA48506.2021.9560808,Robotics
1032,Anytime Fault-tolerant Adaptive Routing for Multi-Robot Teams.,2021,Ronaldo F. dos Santos & Erickson R. Nascimento & Douglas G. Macharet,conf/icra/SantosNM21,https://doi.org/10.1109/ICRA48506.2021.9561944,Robotics
1033,Accurate and Efficient Self-Localization on Roads using Basic Geometric Primitives.,2019,Julius Kümmerle & Marc Sons & Fabian Poggenhans & Tilman Kühner & Martin Lauer & Christoph Stiller,conf/icra/KummerleSPKLS19,https://doi.org/10.1109/ICRA.2019.8793497,Robotics
1034,Enhancing Flexibility and Adaptability in Conjoined Human-Robot Industrial Tasks with a Minimalist Physical Interface.,2022,Juan M. Gandarias & Pietro Balatti & Edoardo Lamon & Marta Lorenzini & Arash Ajoudani,conf/icra/GandariasBLLA22,https://doi.org/10.1109/ICRA46639.2022.9812225,Robotics
1035,Ada-Detector: Adaptive Frontier Detector for Rapid Exploration.,2022,Zezhou Sun & Banghe Wu & Chengzhong Xu 0001 & Hui Kong,conf/icra/SunW0K22,https://doi.org/10.1109/ICRA46639.2022.9811614,Robotics
1036,A Self-Supervised Near-to-Far Approach for Terrain-Adaptive Off-Road Autonomous Driving.,2021,Orighomisan Mayuku & Brian W. Surgenor & Joshua A. Marshall,conf/icra/MayukuSM21,https://doi.org/10.1109/ICRA48506.2021.9562029,Robotics
1037,Self-Organized Evasive Fountain Maneuvers with a Bioinspired Underwater Robot Collective.,2021,Florian Berlinger & Paula Wulkop & Radhika Nagpal,conf/icra/BerlingerWN21,https://doi.org/10.1109/ICRA48506.2021.9561407,Robotics
1038,Learning Domain Adaptation with Model Calibration for Surgical Report Generation in Robotic Surgery.,2021,Mengya Xu & Mobarakol Islam & Chwee Ming Lim & Hongliang Ren 0001,conf/icra/XuIL021,https://doi.org/10.1109/ICRA48506.2021.9561569,Robotics
1039,A Passively Adaptable Toroidal Continuously Variable Transmission Combined with Twisted String Actuator.,2022,Wonseok Shin & Sungbin Park & GunHee Park & Jung Kim,conf/icra/ShinPPK22,https://doi.org/10.1109/ICRA46639.2022.9811545,Robotics
1040,Joining High-Level Symbolic Planning with Low-Level Motion Primitives in Adaptive HRI: Application to Dressing Assistance.,2018,Gerard Canal & Emmanuel Pignat & Guillem Alenyà & Sylvain Calinon & Carme Torras,conf/icra/CanalPACT18,https://doi.org/10.1109/ICRA.2018.8460606,Robotics
1041,Sim-to-Real Visual Grasping via State Representation Learning Based on Combining Pixel-Level and Feature-Level Domain Adaptation.,2021,Youngbin Park & Sang Hyoung Lee & Il Hong Suh,conf/icra/ParkLS21,https://doi.org/10.1109/ICRA48506.2021.9561302,Robotics
1042,An end-to-end approach to making self-folded 3D surface shapes by uniform heating.,2014,Byoungkwon An & Shuhei Miyashita & Michael Thomas Tolley & Daniel M. Aukes & Laura Meeker & Erik D. Demaine & Martin L. Demaine & Robert J. Wood & Daniela Rus,conf/icra/AnMTAMDDWR14,https://doi.org/10.1109/ICRA.2014.6907045,Robotics
1043,A learning-based shared control architecture for interactive task execution.,2017,Firas Abi-Farraj & Takayuki Osa & Nicolo Pedemonte & Jan Peters 0001 & Gerhard Neumann & Paolo Robuffo Giordano,conf/icra/Abi-FarrajOPPNG17,https://doi.org/10.1109/ICRA.2017.7989042,Robotics
1044,Online self-supervised monocular visual odometry for ground vehicles.,2015,Bhoram Lee & Kostas Daniilidis & Daniel D. Lee,conf/icra/LeeDL15,https://doi.org/10.1109/ICRA.2015.7139928,Robotics
1045,Adaptive Control of Variable-Pitch Propellers: Pursuing Minimum-Effort Operation.,2020,Travis Henderson & Nikolaos Papanikolopoulos,conf/icra/HendersonP20,https://doi.org/10.1109/ICRA40945.2020.9197208,Robotics
1046,Adaptive saccade controller inspired by the primates' cerebellum.,2015,Marco Antonelli & Angel Juan Duran & Eris Chinellato & Angel P. del Pobil,conf/icra/AntonelliDCP15,https://doi.org/10.1109/ICRA.2015.7139901,Robotics
1047,Orientation-Aware Motion Planning in Complex Workspaces using Adaptive Harmonic Potential Fields.,2019,Panagiotis Vlantis & Constantinos Vrohidis & Charalampos P. Bechlioulis & Kostas J. Kyriakopoulos,conf/icra/VlantisVBK19,https://doi.org/10.1109/ICRA.2019.8794053,Robotics
1048,Using Arm Swing Movements to Maintain the Walking State in a Self-Balanced Lower-Limb Exoskeleton.,2022,Omar Mounir Alaoui & Fabien Expert & Guillaume Morel & Nathanaël Jarrassé,conf/icra/AlaouiEMJ22,https://doi.org/10.1109/ICRA46639.2022.9811824,Robotics
1049,Recursive Feasibility Guided Optimal Parameter Adaptation of Differential Convex Optimization Policies for Safety-Critical Systems.,2022,Hardik Parwana & Dimitra Panagou,conf/icra/ParwanaP22,https://doi.org/10.1109/ICRA46639.2022.9812398,Robotics
1050,Towards the Design of Robotic Drivers for Full-Scale Self-Driving Racing Cars.,2019,Danilo Caporale & Alessandro Settimi & Federico Massa & Francesco Amerotti & Andrea Corti & Adriano Fagiolini & Massimo Guiggiani & Antonio Bicchi & Lucia Pallottino,conf/icra/CaporaleSMACFGB19,https://doi.org/10.1109/ICRA.2019.8793882,Robotics
1051,Privacy-Aware UAV Flights through Self-Configuring Motion Planning.,2020,Yixing Luo & Yijun Yu & Zhi Jin & Yao Li 0011 & Zuohua Ding & Yuan Zhou 0005 & Yang Liu 0003,conf/icra/LuoYJLD0020,https://doi.org/10.1109/ICRA40945.2020.9197564,Robotics
1052,Learning by Demonstration and Adaptation of Finishing Operations Using Virtual Mechanism Approach.,2018,Bojan Nemec & Kenichi Yasuda & Nathanael Mullennix & Nejc Likar & Ales Ude,conf/icra/NemecYMLU18,https://doi.org/10.1109/ICRA.2018.8460603,Robotics
1053,Reinforcement Learning for Adaptive Illumination with X-rays.,2020,Jean-Raymond Betterton & Daniel Ratner & Samuel Webb & Mykel J. Kochenderfer,conf/icra/BettertonRWK20,https://doi.org/10.1109/ICRA40945.2020.9196614,Robotics
1054,PLATO: Policy learning using adaptive trajectory optimization.,2017,Gregory Kahn & Tianhao Zhang & Sergey Levine & Pieter Abbeel,conf/icra/KahnZLA17,https://doi.org/10.1109/ICRA.2017.7989379,Robotics
