hits,title,year,authors,key,ee,venue_category
1476,A robot self-localization system using one-way ultra-wideband communication.,2015,Anton Ledergerber & Michael Hamer & Raffaello D'Andrea,conf/iros/LedergerberHD15,https://doi.org/10.1109/IROS.2015.7353810,Robotics
1477,3D Object Aided Self-Supervised Monocular Depth Estimation.,2022,Songlin Wei & Guodong Chen & Wenzheng Chi & Zhenhua Wang & Lining Sun,conf/iros/WeiCCWS22,https://doi.org/10.1109/IROS47612.2022.9981590,Robotics
1478,Self-Supervised Disentangled Representation Learning for Third-Person Imitation Learning.,2021,Jinghuan Shang & Michael S. Ryoo,conf/iros/ShangR21,https://doi.org/10.1109/IROS51168.2021.9636363,Robotics
1479,Adaptive input shaper design for flexible robot manipulators.,2017,Thomas Solatges & Sébastien Rubrecht & Mathieu Rognant & Philippe Bidaud,conf/iros/SolatgesRRB17,https://doi.org/10.1109/IROS.2017.8202191,Robotics
1480,Task-specific Self-body Controller Acquisition by Musculoskeletal Humanoids: Application to Pedal Control in Autonomous Driving.,2019,Kento Kawaharazuka & Kei Tsuzuki & Shogo Makino & Moritaka Onitsuka & Koki Shinjo & Yuki Asano & Kei Okada & Koji Kawasaki & Masayuki Inaba,conf/iros/KawaharazukaTMO19,https://doi.org/10.1109/IROS40897.2019.8967910,Robotics
1481,Towards a minimal architecture for a printable; modular; and robust sensing skin.,2012,Austin Buchan & Jonathan Bachrach & Ronald S. Fearing,conf/iros/BuchanBF12,https://doi.org/10.1109/IROS.2012.6386210,Robotics
1482,Humanoid full-body controller adapting constraints in structured objects through updating task-level reference force.,2012,Shunichi Nozawa & Iori Kumagai & Youhei Kakiuchi & Kei Okada & Masayuki Inaba,conf/iros/NozawaKKOI12,https://doi.org/10.1109/IROS.2012.6386085,Robotics
1483,Learning the post-contact reconfiguration of the hand object system for adaptive grasping mechanisms.,2017,Minas V. Liarokapis & Aaron M. Dollar,conf/iros/LiarokapisD17,https://doi.org/10.1109/IROS.2017.8202171,Robotics
1484,Self-Supervised Online Reward Shaping in Sparse-Reward Environments.,2021,Farzan Memarian & Wonjoon Goo & Rudolf Lioutikov & Scott Niekum & Ufuk Topcu,conf/iros/MemarianGLNT21,https://doi.org/10.1109/IROS51168.2021.9636020,Robotics
1485,Self-supervised Object Tracking with Cycle-consistent Siamese Networks.,2020,Weihao Yuan & Michael Yu Wang & Qifeng Chen,conf/iros/YuanWC20,https://doi.org/10.1109/IROS45743.2020.9341621,Robotics
1486,A real-time distributed architecture for large-scale tactile sensing.,2014,Emanuele Baglini & Shahbaz Youssefi & Fulvio Mastrogiovanni & Giorgio Cannata,conf/iros/BagliniYMC14,https://doi.org/10.1109/IROS.2014.6942778,Robotics
1487,Robust optical-flow based self-motion estimation for a quadrotor UAV.,2012,Volker Grabe & Heinrich H. Bülthoff & Paolo Robuffo Giordano,conf/iros/GrabeBG12,https://doi.org/10.1109/IROS.2012.6386234,Robotics
1488,Path Negotiation for Self-interested Multirobot Vehicles in Shared Space.,2020,Hiroaki Inotsume & Aayush Aggarwal & Ryota Higa & Shinji Nakadai,conf/iros/InotsumeAHN20,https://doi.org/10.1109/IROS45743.2020.9341305,Robotics
1489,An Adaptive; Affordable; Humanlike Arm Hand System for Deaf and DeafBlind Communication with the American Sign Language.,2022,Che-Ming Chang & Felipe Sanches & Geng Gao & Samantha Johnson & Minas V. Liarokapis,conf/iros/ChangSGJL22,https://doi.org/10.1109/IROS47612.2022.9982052,Robotics
1490,Adaptive friction compensation in trajectory tracking control of DLR medical robots with elastic joints.,2012,Luc Le Tien & Alin Albu-Schäffer,conf/iros/TienA12,https://doi.org/10.1109/IROS.2012.6385609,Robotics
1491,Self-healing Cell Tactile Sensor Fabricated Using Ultraflexible Printed Electrodes.,2020,Masahiro Shimizu & Toshinori Fujie & Takuya Umedachi & Shunsuke Shigaki & Hiroki Kawashima & Masato Saito & Hirono Ohashi & Koh Hosoda,conf/iros/ShimizuFUSKSOH20,https://doi.org/10.1109/IROS45743.2020.9341005,Robotics
1492,π-SoC: Heterogeneous SoC Architecture for Visual Inertial SLAM Applications.,2018,Jie Tang 0003 & Bo Yu & Shaoshan Liu & Zhe Zhang 0006 & Weikang Fang & Yanjun Zhang,conf/iros/0003YLZFZ18,https://doi.org/10.1109/IROS.2018.8594181,Robotics
1493,SESR: Self-Ensembling Sim-to-Real Instance Segmentation for Auto-Store Bin Picking.,2022,Biqi Yang & Xiaojie Gao & Kai Chen & Rui Cao & Yidan Feng & Xianzhi Li & Qi Dou 0001 & Chi-Wing Fu & Yun-Hui Liu & Pheng-Ann Heng,conf/iros/YangGCCFL0FLH22,https://doi.org/10.1109/IROS47612.2022.9981845,Robotics
1494,Quantifying Safety of Learning-based Self-Driving Control Using Almost-Barrier Functions.,2022,Zhizhen Qin & Tsui-Wei Weng & Sicun Gao,conf/iros/QinWG22,https://doi.org/10.1109/IROS47612.2022.9982058,Robotics
1495,Adaptive Assist-as-needed Control Based on Actor-Critic Reinforcement Learning.,2019,Yufeng Zhang 0003 & Shuai Li & Karen J. Nolan & Damiano Zanotto,conf/iros/ZhangLNZ19,https://doi.org/10.1109/IROS40897.2019.8968464,Robotics
1496,Real-time end-effector motion behavior planning approach using on-line point-cloud data towards a user adaptive assistive bath robot.,2017,Athanasios C. Dometios & Xanthi S. Papageorgiou & Antonis Arvanitakis & Costas S. Tzafestas & Petros Maragos,conf/iros/DometiosPATM17,https://doi.org/10.1109/IROS.2017.8206387,Robotics
1497,Automatic Parameter Adaptation for Quadrotor Trajectory Planning.,2022,Xin Zhou & Chao Xu 0001 & Fei Gao 0011,conf/iros/Zhou0022,https://doi.org/10.1109/IROS47612.2022.9981552,Robotics
1498,Exploiting Sparse Semantic HD Maps for Self-Driving Vehicle Localization.,2019,Wei-Chiu Ma & Raquel Urtasun & Ignacio Tartavull & Ioan Andrei Bârsan & Shenlong Wang & Min Bai & Gellért Máttyus & Namdar Homayounfar & Shrinidhi Kowshika Lakshmikanth & Andrei Pokrovsky,conf/iros/MaUTBWBMHLP19,https://doi.org/10.1109/IROS40897.2019.8968122,Robotics
1499,Content Disentanglement for Semantically Consistent Synthetic-to-Real Domain Adaptation.,2021,Mert Keser & Artem Savkin & Federico Tombari,conf/iros/KeserST21,https://doi.org/10.1109/IROS51168.2021.9635948,Robotics
1500,Self-modeling Tracking Control of Crawler Fire Fighting Robot Based on Causal Network*.,2019,Wenkai Chang & Peng Li & Caiyun Yang & Tao Lu & Yinghao Cai & Shuo Wang 0001,conf/iros/ChangLYLCW19,https://doi.org/10.1109/IROS40897.2019.8968210,Robotics
1501,Climbing vertical terrains with a self-contained robot.,2012,Liyu Wang & Lina Graber & Fumiya Iida,conf/iros/WangGI12,https://doi.org/10.1109/IROS.2012.6385848,Robotics
1502,Torque-Actuated Multimodal Locomotion of Ferrofluid Robot With Environment and Task Adaptability.,2022,Lidong Yang & Mengmeng Sun & Li Zhang 0010,conf/iros/YangS022,https://doi.org/10.1109/IROS47612.2022.9981041,Robotics
1503,TrueÆdapt: Learning Smooth Online Trajectory Adaptation with Bounded Jerk; Acceleration and Velocity in Joint Space.,2020,Jonas C. Kiemel & Robin Weitemeyer & Pascal Meißner & Torsten Kröger,conf/iros/KiemelWMK20,https://doi.org/10.1109/IROS45743.2020.9341001,Robotics
1504,Online velocity constraint adaptation for safe and efficient human-robot workspace sharing.,2020,Lucas Joseph & Joshua K. Pickard & Vincent Padois & David Daney,conf/iros/JosephPPD20,https://doi.org/10.1109/IROS45743.2020.9340961,Robotics
1505,HiGen: A high-speed genderless mechanical connection mechanism with single-sided disconnect for self-reconfigurable modular robots.,2014,Christopher Parrott & Tony J. Dodd & Roderich Gross,conf/iros/ParrottDG14,https://doi.org/10.1109/IROS.2014.6943114,Robotics
1506,Adaptive exploration for continual reinforcement learning.,2012,Freek Stulp,conf/iros/Stulp12,https://doi.org/10.1109/IROS.2012.6385818,Robotics
1507,Magnetic microrobot control using an adaptive fuzzy sliding-mode method.,2022,Alireza Mousavi & Hesam Khaksar & Awais Ahmed & Hongsoo Choi & Ali Kafash Hoshiar,conf/iros/MousaviKACH22,https://doi.org/10.1109/IROS47612.2022.9981438,Robotics
1508,"""I'mConfident This Will End Poorly"": Robot Proficiency Self-Assessment in Human-Robot Teaming.",2022,Nicholas Conlon & Daniel Szafir & Nisar R. Ahmed,conf/iros/ConlonSA22,https://doi.org/10.1109/IROS47612.2022.9981653,Robotics
1509,ReachFlow: An Online Safety Assurance Framework for Waypoint-Following of Self-driving Cars.,2020,Qin Lin & Xin Chen 0002 & Aman Khurana & John M. Dolan,conf/iros/LinCKD20,https://doi.org/10.1109/IROS45743.2020.9341122,Robotics
1510,Adaptive patrolling by mobile robot for changing visitor trends.,2016,Satoshi Hoshino & Shingo Ugajin,conf/iros/HoshinoU16,https://doi.org/10.1109/IROS.2016.7759041,Robotics
1511,Adaptive Hyperparameter Tuning for Black-box LiDAR Odometry.,2021,Kenji Koide & Masashi Yokozuka & Shuji Oishi & Atsuhiko Banno,conf/iros/KoideYOB21,https://doi.org/10.1109/IROS51168.2021.9636038,Robotics
1512,Learning Synergies Between Pushing and Grasping with Self-Supervised Deep Reinforcement Learning.,2018,Andy Zeng & Shuran Song & Stefan Welker & Johnny Lee & Alberto Rodriguez 0003 & Thomas A. Funkhouser,conf/iros/ZengSWLRF18,https://doi.org/10.1109/IROS.2018.8593986,Robotics
1513,Discrete-time stability analysis of a control architecture for heterogeneous robotic systems.,2013,Magnus Bjerkeng & Pietro Falco & Ciro Natale & Kristin Ytterstad Pettersen,conf/iros/BjerkengFNP13,https://doi.org/10.1109/IROS.2013.6697045,Robotics
1514,Preliminary evaluation of a new control approach to achieve speed adaptation in robotic transfemoral prostheses.,2014,Tommaso Lenzi & Levi J. Hargrove & Jonathon W. Sensinger,conf/iros/LenziHS14,https://doi.org/10.1109/IROS.2014.6942836,Robotics
1515,Adaptive force/velocity control for multi-robot cooperative manipulation under uncertain kinematic parameters.,2013,Sebastian Erhart & Sandra Hirche,conf/iros/ErhartH13,https://doi.org/10.1109/IROS.2013.6696369,Robotics
1516,Adaptive Robot Body Learning and Estimation Through Predictive Coding.,2018,Pablo Lanillos & Gordon Cheng,conf/iros/LanillosC18,https://doi.org/10.1109/IROS.2018.8593684,Robotics
1517,A Registration-aided Domain Adaptation Network for 3D Point Cloud Based Place Recognition.,2021,Zhijian Qiao & Hanjiang Hu & Weiang Shi & Siyuan Chen & Zhe Liu 0022 & Hesheng Wang 0001,conf/iros/QiaoHSCLW21,https://doi.org/10.1109/IROS51168.2021.9635878,Robotics
1518,Hybrid Approach for Stabilizing Large Time Delays in Cooperative Adaptive Cruise Control with Reduced Performance Penalties.,2022,Kuei-Fang Hsueh & Ayleen Farnood & Mohammad Al Janaideh & Deepa Kundur,conf/iros/HsuehFJK22,https://doi.org/10.1109/IROS47612.2022.9981245,Robotics
1519,Multi-robot path planning for budgeted active perception with self-organising maps.,2016,Graeme Best & Jan Faigl & Robert Fitch,conf/iros/BestFF16,https://doi.org/10.1109/IROS.2016.7759489,Robotics
1520,Towards a User Adaptive Assistive Robot: Learning from Demonstration Using Navigation Functions.,2021,Xanthi S. Papageorgiou & Athanasios C. Dometios & Costas S. Tzafestas,conf/iros/PapageorgiouDT21,https://doi.org/10.1109/IROS51168.2021.9636200,Robotics
1521,An In-pipe Inspection Module with an Omnidirectional Bent-pipe Self-adaptation Mechanism using a Joint Torque Control.,2019,Atsushi Kakogawa & Shugen Ma,conf/iros/KakogawaM19,https://doi.org/10.1109/IROS40897.2019.8968221,Robotics
1522,High-power; flexible; robust hand: Development of musculoskeletal hand using machined springs and realization of self-weight supporting motion with humanoid.,2017,Shogo Makino & Kento Kawaharazuka & Masaya Kawamura & Yuki Asano & Kei Okada & Masayuki Inaba,conf/iros/MakinoKKAOI17,https://doi.org/10.1109/IROS.2017.8202291,Robotics
1523,Autonomous 6D-docking and manipulation with non-stationary-base using self-reconfigurable modular robots.,2016,Luenin Barrios & Thomas Joseph Collins & Robert Kovac & Wei-Min Shen,conf/iros/BarriosCKS16,https://doi.org/10.1109/IROS.2016.7759451,Robotics
1524,Deriving dexterous; in-hand manipulation primitives for adaptive robot hands.,2017,Minas V. Liarokapis & Aaron M. Dollar,conf/iros/LiarokapisD17a,https://doi.org/10.1109/IROS.2017.8206014,Robotics
1525,Adaptive image-based positioning of RCM mechanisms using angle and distance features.,2015,David Navarro-Alarcon & Hiu Man Yip & Zerui Wang & Yunhui Liu & Weiyang Lin & Peng Li 0019,conf/iros/Navarro-Alarcon15,https://doi.org/10.1109/IROS.2015.7354141,Robotics
1526,Towards a user-adaptive context-aware robotic walker with a pathological gait assessment system: First experimental study.,2017,Georgia Chalvatzaki & Xanthi S. Papageorgiou & Costas S. Tzafestas,conf/iros/ChalvatzakiPT17,https://doi.org/10.1109/IROS.2017.8206388,Robotics
1527,Kitting in the Wild through Online Domain Adaptation.,2018,Massimiliano Mancini & Hakan Karaoguz & Elisa Ricci 0001 & Patric Jensfelt & Barbara Caputo,conf/iros/ManciniK0JC18,https://doi.org/10.1109/IROS.2018.8593862,Robotics
1528,TerraPN: Unstructured Terrain Navigation using Online Self-Supervised Learning.,2022,Adarsh Jagan Sathyamoorthy & Kasun Weerakoon & Tianrui Guan & Jing Liang 0006 & Dinesh Manocha,conf/iros/SathyamoorthyWG22,https://doi.org/10.1109/IROS47612.2022.9981942,Robotics
1529,"""Can ants inspire robots?"" Self-organized decision making in robotic swarms.",2012,Arne Brutschy & Alexander Scheidler & Eliseo Ferrante & Marco Dorigo & Mauro Birattari,conf/iros/BrutschySFDB12,https://doi.org/10.1109/IROS.2012.6386273,Robotics
1530,Design of a collaborative architecture for human-robot assembly tasks.,2017,Ilias El Makrini & Kelly Merckaert & Dirk Lefeber & Bram Vanderborght,conf/iros/MakriniMLV17,https://doi.org/10.1109/IROS.2017.8205971,Robotics
1531,Generating Adaptive Attending Behaviors using User State Classification and Deep Reinforcement Learning.,2018,Yoshiki Kohari & Jun Miura & Shuji Oishi,conf/iros/KohariMO18,https://doi.org/10.1109/IROS.2018.8594427,Robotics
1532,Adaptive Path Following of Snake Robot on Ground with Unknown and Varied Friction Coefficients.,2018,Gang Wang 0024 & Weixin Yang & Yantao Shen 0001 & Haiyan Shao,conf/iros/WangYSS18,https://doi.org/10.1109/IROS.2018.8594466,Robotics
1533,Improving control precision and motion adaptiveness for surgical robot with recurrent neural network.,2017,Yangming Li & Shuai Li 0002 & David E. Caballero & Muneaki Miyasaka & Andrew Lewis & Blake Hannaford,conf/iros/LiLCMLH17,https://doi.org/10.1109/IROS.2017.8206197,Robotics
1534,OmniClimber: An omnidirectional light weight climbing robot with flexibility to adapt to non-flat surfaces.,2012,Mahmoud Tavakoli & Lino Marques & Anibal T. de Almeida,conf/iros/TavakoliMA12,https://doi.org/10.1109/IROS.2012.6385454,Robotics
1535,Adaptive Informative Sampling with Environment Partitioning for Heterogeneous Multi-Robot Systems.,2020,Yunfei Shi & Ning Wang & Jianmin Zheng & Yang Zhang & Sha Yi & Wenhao Luo & Katia P. Sycara,conf/iros/ShiWZZYLS20,https://doi.org/10.1109/IROS45743.2020.9341711,Robotics
1536,Adaptive neighborhood selection for real-time surface normal estimation from organized point cloud data using integral images.,2012,Stefan Holzer & Radu Bogdan Rusu & M. Dixon & Suat Gedikli & Nassir Navab,conf/iros/HolzerRDGN12,https://doi.org/10.1109/IROS.2012.6385999,Robotics
1537,Adaptive Leader-Follower Formation Control and Obstacle Avoidance via Deep Reinforcement Learning.,2019,Yanlin Zhou & Fan Lu & George Pu & Xiyao Ma & Runhan Sun & Hsi-Yuan Chen & Xiaolin Li 0001,conf/iros/ZhouLPMSC019,https://doi.org/10.1109/IROS40897.2019.8967561,Robotics
1538,Robust Outdoor Self-localization In Changing Environments.,2019,Muhammad Haris 0003 & Mathias Franzius & Ute Bauer-Wersing,conf/iros/HarisFB19,https://doi.org/10.1109/IROS40897.2019.8967549,Robotics
1539,3D Printed Single Incision Laparoscopic Manipulator System Adapted to the Required Forces in Laparoscopic Surgery.,2019,Sandra V. Brecht & Matthias Stock & Jens-Uwe Stolzenburg & Tim C. Lueth,conf/iros/BrechtSSL19,https://doi.org/10.1109/IROS40897.2019.8967729,Robotics
1540,Pit30M: A Benchmark for Global Localization in the Age of Self-Driving Cars.,2020,Julieta Martinez & Sasha Doubov & Jack Fan & Ioan Andrei Bârsan & Shenlong Wang & Gellért Máttyus & Raquel Urtasun,conf/iros/MartinezDFBWMU20,https://doi.org/10.1109/IROS45743.2020.9340924,Robotics
1541,Interactive Trajectory Adaptation through Force-guided Bayesian Optimization.,2019,Leonel Dario Rozo,conf/iros/Rozo19,https://doi.org/10.1109/IROS40897.2019.8968571,Robotics
1542,A 3T2R parallel and partially decoupled kinematic architecture.,2013,Matteo Malosio & Simone Pio Negri & Nicola Pedrocchi & Federico Vicentini & Lorenzo Molinari Tosatti,conf/iros/MalosioNPVT13,https://doi.org/10.1109/IROS.2013.6696389,Robotics
1543,A neural dynamics architecture for grasping that integrates perception and movement generation and enables on-line updating.,2014,Guido Knips & Stephan K. U. Zibner & Hendrik Reimann & Irina Popova & Gregor Schöner,conf/iros/KnipsZRPS14,https://doi.org/10.1109/IROS.2014.6942627,Robotics
1544,Safe adaptation in multiagent competition.,2022,Macheng Shen & Jonathan P. How,conf/iros/ShenH22,https://doi.org/10.1109/IROS47612.2022.9981763,Robotics
1545,Unified preview control for humanoid postural stability and upper-limb interaction adaptation.,2012,Aurélien Ibanez & Philippe Bidaud & Vincent Padois,conf/iros/IbanezBP12,https://doi.org/10.1109/IROS.2012.6385948,Robotics
1546,Place recognition and self-localization in interior hallways by indoor mobile robots: A signature-based cascaded filtering framework.,2014,Khalil Mustafa Ahmad Yousef & Johnny Park & Avinash C. Kak,conf/iros/YousefPK14,https://doi.org/10.1109/IROS.2014.6943271,Robotics
1547,Collaborative manipulation and transport of passive pieces using the self-reconfigurable modular robots roombots.,2013,Stéphane Bonardi & Massimo Vespignani & Rico Moeckel & Auke Jan Ijspeert,conf/iros/BonardiVMI13,https://doi.org/10.1109/IROS.2013.6696694,Robotics
1548,Using semantic fields to model dynamic spatial relations in a robot architecture for natural language instruction of service robots.,2013,Juan Fasola & Maja J. Mataric,conf/iros/FasolaM13,https://doi.org/10.1109/IROS.2013.6696345,Robotics
1549,Adaptive Model Predictive Control for High-Accuracy Trajectory Tracking in Changing Conditions.,2018,Karime Pereida & Angela P. Schoellig,conf/iros/PereidaS18,https://doi.org/10.1109/IROS.2018.8594267,Robotics
1550,Soft-NeuroAdapt: A 3-DOF neuro-adaptive patient pose correction system for frameless and maskless cancer radiotherapy.,2017,Olalekan P. Ogunmolu & Adwait Kulkarni & Yonas Tadesse & Xuejun Gu & Steve B. Jiang & Nicholas R. Gans,conf/iros/OgunmoluKTGJG17,https://doi.org/10.1109/IROS.2017.8206211,Robotics
1551,In-flight range optimization of multicopters using multivariable extremum seeking with adaptive step size.,2020,Xiangyu Wu & Mark W. Mueller,conf/iros/WuM20,https://doi.org/10.1109/IROS45743.2020.9340762,Robotics
1552,Bootstrapped Self-Supervised Training with Monocular Video for Semantic Segmentation and Depth Estimation.,2021,Yihao Zhang & John J. Leonard,conf/iros/ZhangL21,https://doi.org/10.1109/IROS51168.2021.9636330,Robotics
1553,Adaptive Modality Selection Algorithm in Robot-Assisted Cognitive Training.,2018,Aleksandar Taranovic & Aleksandar Jevtic & Carme Torras,conf/iros/TaranovicJT18,https://doi.org/10.1109/IROS.2018.8593730,Robotics
1554,Adaptive under-actuated anthropomorphic hand: ISR-SoftHand.,2014,Mahmoud Tavakoli & Anibal T. de Almeida,conf/iros/TavakoliA14,https://doi.org/10.1109/IROS.2014.6942773,Robotics
1555,A learning from demonstration system architecture for robots learning social group recreational activities.,2016,Wing-Yue Geoffrey Louie & Goldie Nejat,conf/iros/LouieN16,https://doi.org/10.1109/IROS.2016.7759144,Robotics
1556,Deformation Capture via Self-Sensing Capacitive Arrays (Video).,2018,Oliver Glauser & Daniele Panozzo & Otmar Hilliges & Olga Sorkine-Hornung,conf/iros/GlauserPHS18,https://doi.org/10.1109/IROS.2018.8594203,Robotics
1557,Mobile robot control on uneven and slippery ground: An adaptive approach based on a multi-model observer.,2012,Roland Lenain & Benoît Thuilot,conf/iros/LenainT12,https://doi.org/10.1109/IROS.2012.6385533,Robotics
1558,Self-calibrated dense 3D sensor using multiple cross line-lasers based on light sectioning method and visual odometry.,2021,Genki Nagamatsu & Jun Takamatsu & Takafumi Iwaguchi & Diego Thomas & Hiroshi Kawasaki,conf/iros/NagamatsuTITK21,https://doi.org/10.1109/IROS51168.2021.9636505,Robotics
1559,Neural Control with an Artificial Hormone System for Energy-Efficient Compliant Terrain Locomotion and Adaptation of Walking Robots.,2019,Jettanan Homchanthanakul & Potiwat Ngamkajornwiwat & Pitiwut Teerakittikul & Poramate Manoonpong,conf/iros/Homchanthanakul19,https://doi.org/10.1109/IROS40897.2019.8968580,Robotics
1560,Tidying Deep Saliency Prediction Architectures.,2020,Navyasri Reddy & Samyak Jain & Pradeep Yarlagadda & Vineet Gandhi,conf/iros/ReddyJYG20,https://doi.org/10.1109/IROS45743.2020.9341574,Robotics
1561,Cognitive Robotic Architecture for Semi-Autonomous Execution of Manipulation Tasks in a Surgical Environment.,2019,Giacomo De Rossi & Marco Minelli & Alessio Sozzi & Nicola Piccinelli & Federica Ferraguti & Francesco Setti & Marcello Bonfè & Cristian Secchi & Riccardo Muradore,conf/iros/RossiMSPFSBSM19,https://doi.org/10.1109/IROS40897.2019.8967667,Robotics
1562,Adaptive perception: Learning from sensory predictions to extract object shape with a biomimetic fingertip.,2017,Uriel Martinez-Hernandez & Tony J. Prescott,conf/iros/Martinez-Hernandez17,https://doi.org/10.1109/IROS.2017.8206590,Robotics
1563,Volumetric Tree*: Adaptive Sparse Graph for Effective Exploration of Homotopy Classes.,2019,Donghyuk Kim & Mincheul Kang & Sung-Eui Yoon,conf/iros/KimKY19,https://doi.org/10.1109/IROS40897.2019.8967728,Robotics
1564,Design and architecture of a series elastic snake robot.,2014,David Rollinson & Yigit Bilgen & Ben Brown & Florian Enner & Steven Ford & Curtis Layton & Justine Rembisz & Michael Schwerin & Andrew Willig & Pras Velagapudi & Howie Choset,conf/iros/RollinsonBBEFLRSWVC14,https://doi.org/10.1109/IROS.2014.6943219,Robotics
1565,Single-Grasp; Model-Free Object Classification using a Hyper-Adaptive Hand; Google Soli; and Tactile Sensors.,2018,Zak Flintoff & Bruno Johnston & Minas V. Liarokapis,conf/iros/FlintoffJL18,https://doi.org/10.1109/IROS.2018.8594166,Robotics
1566,A Safety-Aware Architecture for Task Scheduling and Execution for Human-Robot Collaboration.,2021,Andrea Pupa & Cristian Secchi,conf/iros/PupaS21,https://doi.org/10.1109/IROS51168.2021.9636855,Robotics
1567,Reactive phase and task space adaptation for robust motion execution.,2014,Peter Englert & Marc Toussaint,conf/iros/EnglertT14,https://doi.org/10.1109/IROS.2014.6942548,Robotics
1568,Human guided trajectory and impedance adaptation for tele-operated physical assistance.,2021,Guillaume Gourmelen & Benjamin Navarro & Andrea Cherubini & Gowrishankar Ganesh,conf/iros/GourmelenNCG21,https://doi.org/10.1109/IROS51168.2021.9636418,Robotics
1569,Learning Feature Decomposition for Domain Adaptive Monocular Depth Estimation.,2022,Shao-Yuan Lo & Wei Wang & Jim Thomas 0001 & Jingjing Zheng & Vishal M. Patel & Cheng-Hao Kuo,conf/iros/LoW0ZPK22,https://doi.org/10.1109/IROS47612.2022.9981342,Robotics
1570,Self-supervised 3D Shape and Viewpoint Estimation from Single Images for Robotics.,2019,Oier Mees & Maxim Tatarchenko & Thomas Brox & Wolfram Burgard,conf/iros/MeesTBB19,https://doi.org/10.1109/IROS40897.2019.8967916,Robotics
1571,On CAD Informed Adaptive Robotic Assembly.,2022,Yotto Koga & Heather Kerrick & Sachin Chitta,conf/iros/KogaKC22,https://doi.org/10.1109/IROS47612.2022.9982242,Robotics
1572,Detecting Grasp Phases and Adaption of Object-Hand Interaction Forces of a Soft Humanoid Hand Based on Tactile Feedback.,2021,Pascal Weiner & Felix Hundhausen & Raphael Grimm & Tamim Asfour,conf/iros/WeinerHGA21,https://doi.org/10.1109/IROS51168.2021.9636484,Robotics
1573,Adaptive 3D pose computation of suturing needle using constraints from static monocular image feedback.,2016,Fangxun Zhong & David Navarro-Alarcon & Zerui Wang & Yunhui Liu & Tianxue Zhang & Hiu Man Yip & Hesheng Wang 0001,conf/iros/ZhongNWLZYW16,https://doi.org/10.1109/IROS.2016.7759812,Robotics
1574,Adaptive Vision-Based Control for Rope-Climbing Robot Manipulator.,2019,Guangli Sun & Xiang Li 0009 & Peng Li 0019 & Linzhu Yue & Zhen Yu & Yang Zhou & Yun-Hui Liu,conf/iros/SunLLYYZL19,https://doi.org/10.1109/IROS40897.2019.8967976,Robotics
1575,Adaptive Trajectory Planning and optimization at Limits of Handling.,2019,Lars J. Svensson & Monimoy Bujarbaruah & Nitin R. Kapania & Martin Törngren,conf/iros/SvenssonBKT19,https://doi.org/10.1109/IROS40897.2019.8967679,Robotics
1576,A Sliding Mode Control Architecture for Human-Manipulator Cooperative Surface Treatment Tasks.,2018,Luis Gracia & J. Ernesto Solanes & Pau Muñoz-Benavent & Jaime Valls Miró & Carlos Pérez-Vidal & Josep Tornero,conf/iros/GraciaSMMPT18,https://doi.org/10.1109/IROS.2018.8593444,Robotics
1577,Adaptive repetitive visual-servo control of a low-flying unmanned aerial vehicle with an uncalibrated high-flying camera.,2016,Dejun Guo & Woosoon Yim & Kam K. Leang,conf/iros/GuoYL16,https://doi.org/10.1109/IROS.2016.7759627,Robotics
1578,3D Coating Self-Assembly for Modular Robotic Scaffolds.,2020,Pierre Thalamy & Benoît Piranda & Julien Bourgeois,conf/iros/ThalamyPB20,https://doi.org/10.1109/IROS45743.2020.9341324,Robotics
1579,A Self-Biasing Shape Memory Alloy Gripper for Lightweight Applications.,2021,Sean Thomas & Gabriel Maquignaz & Adrien Thabuis & Yves Perriard,conf/iros/ThomasMTP21,https://doi.org/10.1109/IROS51168.2021.9636155,Robotics
1580,Experimental validation of a new adaptive control scheme for quadrotors MAVs.,2013,Gianluca Antonelli & Elisabetta Cataldi & Paolo Robuffo Giordano & Stefano Chiaverini & Antonio Franchi,conf/iros/AntonelliCGCF13,https://doi.org/10.1109/IROS.2013.6696699,Robotics
